{
  "$schema": "https://github.com/Jiayang-Lai/100-Days-of-KQL/raw/refs/heads/main/schemas/files/table.json",
  "table_name": "DeviceNetworkEvents",
  "table_description": "Microsoft Defender for Endpoints (MDE) device network events table. This table contains information about network connections and related events initiated by processes running on the endpoint.",
  "reference": "https://learn.microsoft.com/en-us/azure/azure-monitor/reference/tables/devicenetworkevents",
  "columns": [
    {
      "name": "ActionType",
      "type": "string",
      "description": "Type of activity that triggered the event."
    },
    {
      "name": "AdditionalFields",
      "type": "dynamic",
      "description": "Additional information about the entity or event."
    },
    {
      "name": "AppGuardContainerId",
      "type": "string",
      "description": "Identifier for the virtualized container used by Application Guard to isolate browser activity."
    },
    {
      "name": "_BilledSize",
      "type": "real",
      "description": "The record size in bytes"
    },
    {
      "name": "DeviceId",
      "type": "string",
      "description": "Unique identifier for the device in the service."
    },
    {
      "name": "DeviceName",
      "type": "string",
      "description": "Fully qualified domain name (FQDN) of the device."
    },
    {
      "name": "InitiatingProcessAccountDomain",
      "type": "string",
      "description": "Domain of the account that ran the initiating process."
    },
    {
      "name": "InitiatingProcessAccountName",
      "type": "string",
      "description": "User name of the account that ran the initiating process."
    },
    {
      "name": "InitiatingProcessAccountObjectId",
      "type": "string",
      "description": "Azure AD object ID of the user account that ran the initiating process."
    },
    {
      "name": "InitiatingProcessAccountSid",
      "type": "string",
      "description": "Security Identifier (SID) of the account that ran the initiating process."
    },
    {
      "name": "InitiatingProcessAccountUpn",
      "type": "string",
      "description": "User principal name (UPN) of the account that ran the initiating process."
    },
    {
      "name": "InitiatingProcessCommandLine",
      "type": "string",
      "description": "Command line used to run the initiating process."
    },
    {
      "name": "InitiatingProcessCreationTime",
      "type": "datetime",
      "description": "Date and time when the process that initiated the event was started."
    },
    {
      "name": "InitiatingProcessFileName",
      "type": "string",
      "description": "Name of the initiating process."
    },
    {
      "name": "InitiatingProcessFileSize",
      "type": "long",
      "description": "Size of the file (bytes) that ran the process responsible for the event."
    },
    {
      "name": "InitiatingProcessFolderPath",
      "type": "string",
      "description": "Folder containing the initiating process (image file)."
    },
    {
      "name": "InitiatingProcessId",
      "type": "long",
      "description": "Process ID (PID) of the initiating process."
    },
    {
      "name": "InitiatingProcessIntegrityLevel",
      "type": "string",
      "description": "Integrity level of the initiating process. Windows assigns integrity levels to processes based on certain characteristics, such as if they were launched from an internet download. These integrity levels influence permissions to resources.."
    },
    {
      "name": "InitiatingProcessMD5",
      "type": "string",
      "description": "MD5 hash of the initiating process (image file)."
    },
    {
      "name": "InitiatingProcessParentCreationTime",
      "type": "datetime",
      "description": "Date and time when the parent of the process responsible for the event was started."
    },
    {
      "name": "InitiatingProcessParentFileName",
      "type": "string",
      "description": "Name of the parent process that spawned the initiating process."
    },
    {
      "name": "InitiatingProcessParentId",
      "type": "long",
      "description": "Process ID (PID) of the parent process that spawned the initiating process."
    },
    {
      "name": "InitiatingProcessRemoteSessionDeviceName",
      "type": "string",
      "description": "Device name of the remote device from which the initiating process's RDP session was initiated."
    },
    {
      "name": "InitiatingProcessRemoteSessionIP",
      "type": "string",
      "description": "IP address of the remote device from which the initiating process's RDP session was initiated."
    },
    {
      "name": "InitiatingProcessSessionId",
      "type": "long",
      "description": "Windows session ID of the initiating process."
    },
    {
      "name": "InitiatingProcessSHA1",
      "type": "string",
      "description": "SHA-1 hash of the initiating process (image file)."
    },
    {
      "name": "InitiatingProcessSHA256",
      "type": "string",
      "description": "SHA-256 hash of the initiating process (image file). In some cases this column may not be populated - please use the InitiatingProcessSHA1 column instead."
    },
    {
      "name": "InitiatingProcessTokenElevation",
      "type": "string",
      "description": "Token type indicating the presence or absence of User Access Control (UAC) privilege elevation applied to the initiating process."
    },
    {
      "name": "InitiatingProcessUniqueId",
      "type": "string",
      "description": "Unique identifier of the initiating process; this is equal to the Process Start Key in Windows devices."
    },
    {
      "name": "InitiatingProcessVersionInfoCompanyName",
      "type": "string",
      "description": "The company name in version information (image file) responsible for the event."
    },
    {
      "name": "InitiatingProcessVersionInfoFileDescription",
      "type": "string",
      "description": "The description in version information (image file) responsible for the event."
    },
    {
      "name": "InitiatingProcessVersionInfoInternalFileName",
      "type": "string",
      "description": "The internal file name in version information (image file) responsible for the event."
    },
    {
      "name": "InitiatingProcessVersionInfoOriginalFileName",
      "type": "string",
      "description": "The original file name in version information (image file) responsible for the event."
    },
    {
      "name": "InitiatingProcessVersionInfoProductName",
      "type": "string",
      "description": "The product name in version information (image file) responsible for the event."
    },
    {
      "name": "InitiatingProcessVersionInfoProductVersion",
      "type": "string",
      "description": "The product version in version information (image file) responsible for the event."
    },
    {
      "name": "_IsBillable",
      "type": "string",
      "description": "Specifies whether ingesting the data is billable. When _IsBillable is false ingestion isn't billed to your Azure account"
    },
    {
      "name": "IsInitiatingProcessRemoteSession",
      "type": "bool",
      "description": "Indicates whether the initiating process was run under a remote desktop protocol (RDP) session (true) or locally (false)."
    },
    {
      "name": "LocalIP",
      "type": "string",
      "description": "IP address assigned to the local machine used during communication."
    },
    {
      "name": "LocalIPType",
      "type": "string",
      "description": "Type of IP address, for example Public, Private, Reserved, Loopback, Teredo, FourToSixMapping, and Broadcast."
    },
    {
      "name": "LocalPort",
      "type": "int",
      "description": "TCP port on the local machine used during communication."
    },
    {
      "name": "MachineGroup",
      "type": "string",
      "description": "Machine group of the machine. This group is used by role-based access control to determine access to the machine."
    },
    {
      "name": "Protocol",
      "type": "string",
      "description": "IP protocol used, whether TCP or UDP."
    },
    {
      "name": "RemoteIP",
      "type": "string",
      "description": "IP address that was being connected to."
    },
    {
      "name": "RemoteIPType",
      "type": "string",
      "description": "Type of IP address, for example Public, Private, Reserved, Loopback, Teredo, FourToSixMapping, and Broadcast."
    },
    {
      "name": "RemotePort",
      "type": "int",
      "description": "TCP port on the remote device that was being connected to."
    },
    {
      "name": "RemoteUrl",
      "type": "string",
      "description": "URL or fully qualified domain name (FQDN) that was being connected to."
    },
    {
      "name": "ReportId",
      "type": "long",
      "description": "Event identifier based on a repeating counter. To identify unique events, this column must be used in conjunction with the ComputerName and EventTime columns.."
    },
    {
      "name": "SourceSystem",
      "type": "string",
      "description": "The type of agent the event was collected by. For example, OpsManager for Windows agent, either direct connect or Operations Manager, Linux for all Linux agents, or Azure for Azure Diagnostics"
    },
    {
      "name": "TenantId",
      "type": "string",
      "description": "The Log Analytics workspace ID"
    },
    {
      "name": "TimeGenerated",
      "type": "datetime",
      "description": "Date and time the event was recorded by the MDE agent on the endpoint."
    },
    {
      "name": "Type",
      "type": "string",
      "description": "The name of the table"
    }
  ]
}